,state,opened_on,time_to_close,closed_at,commits,number,title,url,closed
0,closed,2021-10-07 12:09:55,15529.0,2021-10-07 16:28:44,1,979,remove grammars from legal notice,https://api.github.com/repos/eclipse-cyclonedds/cyclonedds/pulls/979,
1,open,2021-10-07 08:50:59,,,24,978,Update for 0.8.1,https://api.github.com/repos/eclipse-cyclonedds/cyclonedds/pulls/978,
2,open,2021-10-05 08:44:15,,,3,975,Win32 stack trace of current thread,https://api.github.com/repos/eclipse-cyclonedds/cyclonedds/pulls/975,
3,closed,2021-10-04 12:08:38,71673.0,2021-10-05 08:03:11,1,974,Fix use of non-existent paths when building as a subproject,https://api.github.com/repos/eclipse-cyclonedds/cyclonedds/pulls/974,
4,open,2021-10-01 14:13:50,,,1,973,Add checks on inheritance,https://api.github.com/repos/eclipse-cyclonedds/cyclonedds/pulls/973,
5,closed,2021-09-30 19:39:29,2817.0,2021-09-30 20:26:26,1,972,Fix incorrect bitshift in filetime_to_time.,https://api.github.com/repos/eclipse-cyclonedds/cyclonedds/pulls/972,
6,closed,2021-09-30 18:55:10,45557.0,2021-10-01 07:34:27,1,971,Implement log_stacktrace on Win32,https://api.github.com/repos/eclipse-cyclonedds/cyclonedds/pulls/971,
7,closed,2021-09-30 13:03:14,414314.0,2021-10-05 08:08:28,1,970,Support anonymous types in union cases,https://api.github.com/repos/eclipse-cyclonedds/cyclonedds/pulls/970,
8,closed,2021-09-29 14:00:56,260148.0,2021-10-02 14:16:44,1,969,Fix for issue #968,https://api.github.com/repos/eclipse-cyclonedds/cyclonedds/pulls/969,
9,open,2021-09-28 14:02:33,,,3,966,Enable shared memory with transient local qos,https://api.github.com/repos/eclipse-cyclonedds/cyclonedds/pulls/966,
10,open,2021-09-27 09:57:07,,,4,963,Add member ID field population and validation,https://api.github.com/repos/eclipse-cyclonedds/cyclonedds/pulls/963,
11,closed,2021-09-24 13:16:26,7418.0,2021-09-24 15:20:04,3,962,Fix use-after-free bugs in IDL parser,https://api.github.com/repos/eclipse-cyclonedds/cyclonedds/pulls/962,
12,closed,2021-09-24 12:11:06,4059.0,2021-09-24 13:18:45,1,961,Replace Codecov by Azure Pipelines Code Coverage,https://api.github.com/repos/eclipse-cyclonedds/cyclonedds/pulls/961,
13,closed,2021-09-23 14:10:40,688210.0,2021-10-01 13:20:50,5,960,Config error handling,https://api.github.com/repos/eclipse-cyclonedds/cyclonedds/pulls/960,
14,closed,2021-09-23 09:34:56,15971.0,2021-09-23 14:01:07,1,959,Bump version number for development branch,https://api.github.com/repos/eclipse-cyclonedds/cyclonedds/pulls/959,
15,closed,2021-09-23 09:31:30,14541.0,2021-09-23 13:33:51,3,958,Backport fix for Bison 3.8.1,https://api.github.com/repos/eclipse-cyclonedds/cyclonedds/pulls/958,
16,closed,2021-09-21 17:02:59,159005.0,2021-09-23 13:13:04,1,954,Update ROS 2 quality declaration,https://api.github.com/repos/eclipse-cyclonedds/cyclonedds/pulls/954,
17,open,2021-09-18 11:36:09,,,1,953,Emit shared object files with libcyclone* names,https://api.github.com/repos/eclipse-cyclonedds/cyclonedds/pulls/953,
18,closed,2021-09-17 12:36:28,500656.0,2021-09-23 07:40:44,2,949,Avoid some undocumented interfaces in bison,https://api.github.com/repos/eclipse-cyclonedds/cyclonedds/pulls/949,
19,closed,2021-09-17 10:02:26,1122694.0,2021-09-30 09:54:00,2,948,CMake changes for cross-compilation,https://api.github.com/repos/eclipse-cyclonedds/cyclonedds/pulls/948,
20,open,2021-09-14 14:40:00,,,1,947,Add compiler option to specify prefix directory,https://api.github.com/repos/eclipse-cyclonedds/cyclonedds/pulls/947,
21,closed,2021-09-13 11:34:48,,,1,945,examples: add support for yocto cross compiling,https://api.github.com/repos/eclipse-cyclonedds/cyclonedds/pulls/945,
22,open,2021-09-10 22:57:05,,,1,944,"Documentation has two different ""default"" values for ParticipantIndex",https://api.github.com/repos/eclipse-cyclonedds/cyclonedds/pulls/944,
23,closed,2021-09-09 12:56:42,1880787.0,2021-10-01 07:23:09,2,943,use iceoryx user header,https://api.github.com/repos/eclipse-cyclonedds/cyclonedds/pulls/943,
24,closed,2021-09-08 15:15:06,4508.0,2021-09-08 16:30:14,1,940,Backport of fix for failing dlopen test to 0.8.x release branch,https://api.github.com/repos/eclipse-cyclonedds/cyclonedds/pulls/940,
25,closed,2021-09-07 18:30:23,46077.0,2021-09-08 07:18:20,1,938,Use correct offset when serializing type consistency qos,https://api.github.com/repos/eclipse-cyclonedds/cyclonedds/pulls/938,
26,closed,2021-09-07 11:18:59,1890455.0,2021-09-29 08:26:34,1,936,Add python idl locator to idlc.,https://api.github.com/repos/eclipse-cyclonedds/cyclonedds/pulls/936,
27,closed,2021-09-07 08:00:04,19366.0,2021-09-07 13:22:50,2,934,Remove VS analyzer and add example for using built-in topics,https://api.github.com/repos/eclipse-cyclonedds/cyclonedds/pulls/934,
28,closed,2021-09-07 07:52:06,6764.0,2021-09-07 09:44:50,1,933,Dereference as void* to avoid crash with -O2,https://api.github.com/repos/eclipse-cyclonedds/cyclonedds/pulls/933,
29,closed,2021-09-06 14:44:41,168401.0,2021-09-08 13:31:22,1,932,Fix dlopen_path test on normal VS/Xcode,https://api.github.com/repos/eclipse-cyclonedds/cyclonedds/pulls/932,
30,closed,2021-09-06 10:10:03,1485243.0,2021-09-23 14:44:06,1,931,Cache Eclipse Iceoryx,https://api.github.com/repos/eclipse-cyclonedds/cyclonedds/pulls/931,
31,closed,2021-09-03 16:30:46,1537313.0,2021-09-21 11:32:39,3,929,Improve diagnostic when idlc loads plugin,https://api.github.com/repos/eclipse-cyclonedds/cyclonedds/pulls/929,
32,closed,2021-09-03 07:59:11,8434.0,2021-09-03 10:19:45,1,928,ddsrt_malloc size for maxq_list is incorrect in find_own_ip,https://api.github.com/repos/eclipse-cyclonedds/cyclonedds/pulls/928,
33,closed,2021-09-03 06:17:41,,,0,927,dsrt_malloc size for maxq_list is incorrect in find_own_ip,https://api.github.com/repos/eclipse-cyclonedds/cyclonedds/pulls/927,
34,closed,2021-09-03 05:22:45,,,1,925,[bug 924] head->aba_head.s.a should be discounted in ddsrt_atomic_lifo_pop,https://api.github.com/repos/eclipse-cyclonedds/cyclonedds/pulls/925,
35,closed,2021-09-01 15:16:59,679740.0,2021-09-09 12:05:59,4,923,Keep weak references to annotatable metadata in IDL tree,https://api.github.com/repos/eclipse-cyclonedds/cyclonedds/pulls/923,
36,open,2021-09-01 06:52:03,,,1,922,Add IDL compiler option to specify the output directory for the generated code (fixes #801),https://api.github.com/repos/eclipse-cyclonedds/cyclonedds/pulls/922,
37,closed,2021-08-31 11:41:40,4951.0,2021-08-31 13:04:11,32,921,Backport from master into 0.8.x,https://api.github.com/repos/eclipse-cyclonedds/cyclonedds/pulls/921,
38,closed,2021-08-30 11:04:33,1456.0,2021-08-30 11:28:49,1,920,Ignore DDS_INLINE_EXPORT in Doxygen build,https://api.github.com/repos/eclipse-cyclonedds/cyclonedds/pulls/920,
39,closed,2021-08-30 09:40:32,2170528.0,2021-09-24 12:36:00,5,919,Additional annotation parsing,https://api.github.com/repos/eclipse-cyclonedds/cyclonedds/pulls/919,
40,closed,2021-08-26 06:50:23,21810.0,2021-08-26 12:53:53,3,917,Fix incorrect QoS handling in dds_create_publisher,https://api.github.com/repos/eclipse-cyclonedds/cyclonedds/pulls/917,
41,closed,2021-08-24 04:23:15,4875.0,2021-08-24 05:44:30,1,913,Fix the wrong description about the default value of ParticipantIndex,https://api.github.com/repos/eclipse-cyclonedds/cyclonedds/pulls/913,
42,closed,2021-08-18 09:36:28,16292.0,2021-08-18 14:08:00,1,910,Subtle CDR key calculation fixes,https://api.github.com/repos/eclipse-cyclonedds/cyclonedds/pulls/910,
43,closed,2021-08-17 11:34:49,8105.0,2021-08-17 13:49:54,1,909,Duplicate increment of input buffer position upon array key readout,https://api.github.com/repos/eclipse-cyclonedds/cyclonedds/pulls/909,
44,closed,2021-08-08 15:46:21,53047.0,2021-08-09 06:30:28,1,906,Make sure to use buffer with truncated name for pthread_setname_np,https://api.github.com/repos/eclipse-cyclonedds/cyclonedds/pulls/906,
45,open,2021-08-05 13:06:49,,,2,904,Implementation of the XTypes type system,https://api.github.com/repos/eclipse-cyclonedds/cyclonedds/pulls/904,
46,open,2021-08-05 10:24:31,,,28,903,XCDR2 support for idlc and cdrstream serializer,https://api.github.com/repos/eclipse-cyclonedds/cyclonedds/pulls/903,
47,open,2021-08-04 11:17:07,,,1,902,Possibility of testing byteswapped input in non-default serdata implementations,https://api.github.com/repos/eclipse-cyclonedds/cyclonedds/pulls/902,
48,closed,2021-08-04 11:13:06,1991843.0,2021-08-27 12:30:29,1,901,OpenDDS compatibility,https://api.github.com/repos/eclipse-cyclonedds/cyclonedds/pulls/901,
49,closed,2021-08-04 11:10:33,1287990.0,2021-08-19 08:57:03,13,900,"Waitsets, listeners and masks",https://api.github.com/repos/eclipse-cyclonedds/cyclonedds/pulls/900,
50,closed,2021-08-03 10:55:51,71657.0,2021-08-04 06:50:08,1,899,Skip all work in tracing addrset calculation if no trace needed,https://api.github.com/repos/eclipse-cyclonedds/cyclonedds/pulls/899,
51,open,2021-08-02 19:50:16,,,2,898,Add read/write instrumentation with LTTng,https://api.github.com/repos/eclipse-cyclonedds/cyclonedds/pulls/898,
52,open,2021-07-28 09:09:17,,,1,896,Sanitize automatic enablement of Iceorxy,https://api.github.com/repos/eclipse-cyclonedds/cyclonedds/pulls/896,
53,closed,2021-07-28 07:48:47,2515234.0,2021-08-26 10:29:21,1,895,"Default message ""using network interface..."" is printed as info",https://api.github.com/repos/eclipse-cyclonedds/cyclonedds/pulls/895,
54,closed,2021-07-20 06:39:51,10.0,2021-07-20 06:40:01,2,890,Update CRL and fix double free,https://api.github.com/repos/eclipse-cyclonedds/cyclonedds/pulls/890,
55,closed,2021-07-19 13:30:43,245882.0,2021-07-22 09:48:45,4,886,Returning writer loans,https://api.github.com/repos/eclipse-cyclonedds/cyclonedds/pulls/886,
56,closed,2021-07-19 13:24:53,91044.0,2021-07-20 14:42:17,6,885,Fix some configuration issues,https://api.github.com/repos/eclipse-cyclonedds/cyclonedds/pulls/885,
57,closed,2021-07-19 09:43:18,13742.0,2021-07-19 13:32:20,2,884,Update CRL (again),https://api.github.com/repos/eclipse-cyclonedds/cyclonedds/pulls/884,
58,closed,2021-07-15 07:38:16,1301.0,2021-07-15 07:59:57,1,882,Increase CRL ,https://api.github.com/repos/eclipse-cyclonedds/cyclonedds/pulls/882,
59,closed,2021-07-14 15:13:27,58212.0,2021-07-15 07:23:39,1,880,Increase the CRL expiration date.,https://api.github.com/repos/eclipse-cyclonedds/cyclonedds/pulls/880,
60,closed,2021-07-14 11:01:07,1701.0,2021-07-14 11:29:28,1,879,Fixed memory-allocation for sampleInfo,https://api.github.com/repos/eclipse-cyclonedds/cyclonedds/pulls/879,
61,closed,2021-07-12 13:06:23,73047.0,2021-07-13 09:23:50,1,878,Regenerate expired test CRLs,https://api.github.com/repos/eclipse-cyclonedds/cyclonedds/pulls/878,
62,closed,2021-07-09 05:51:08,551111.0,2021-07-15 14:56:19,1,877,Adds custom property to ddsc target to indiciate if SHM is supported,https://api.github.com/repos/eclipse-cyclonedds/cyclonedds/pulls/877,
63,open,2021-07-08 16:22:46,,,1,876,Add support for reloading configuration,https://api.github.com/repos/eclipse-cyclonedds/cyclonedds/pulls/876,
64,closed,2021-07-08 15:45:55,321289.0,2021-07-12 09:00:44,1,875,Fix check whether memcpy-based (de)ser is possible,https://api.github.com/repos/eclipse-cyclonedds/cyclonedds/pulls/875,
65,closed,2021-07-07 12:47:21,69788.0,2021-07-08 08:10:29,1,873,Fix emitting of non-printable char cases in unions,https://api.github.com/repos/eclipse-cyclonedds/cyclonedds/pulls/873,
66,closed,2021-07-07 12:47:00,69829.0,2021-07-08 08:10:49,1,872,"Emit ""default"" flag if union has a default case",https://api.github.com/repos/eclipse-cyclonedds/cyclonedds/pulls/872,
67,closed,2021-07-06 07:51:18,,,2,871,Add the option to prematurely return a publisher loan using the already existing dds_return_loan function.,https://api.github.com/repos/eclipse-cyclonedds/cyclonedds/pulls/871,
68,closed,2021-07-05 12:41:09,4497064.0,2021-08-26 13:52:13,1,870,Return actual length from `dds_get_name`/`dds_get_type_name`,https://api.github.com/repos/eclipse-cyclonedds/cyclonedds/pulls/870,
69,closed,2021-07-05 12:33:46,1303648.0,2021-07-20 14:41:14,7,869,"Make ""real"" built-in topic entities inaccessible",https://api.github.com/repos/eclipse-cyclonedds/cyclonedds/pulls/869,
70,closed,2021-06-30 11:46:34,7871.0,2021-06-30 13:57:45,1,866,Do not list files in CMake add_library INTERFACE,https://api.github.com/repos/eclipse-cyclonedds/cyclonedds/pulls/866,
71,closed,2021-06-30 10:44:23,1719962.0,2021-07-20 08:30:25,1,865,Fix assert(thread_is_asleep()) receiving short msg,https://api.github.com/repos/eclipse-cyclonedds/cyclonedds/pulls/865,
72,closed,2021-06-30 10:25:44,1740055.0,2021-07-20 13:46:39,1,864,Add missing dds_ prefix to is_loan_available,https://api.github.com/repos/eclipse-cyclonedds/cyclonedds/pulls/864,
73,closed,2021-06-29 18:18:17,51031.0,2021-06-30 08:28:48,1,863,Support const expressions in idl_type_spec,https://api.github.com/repos/eclipse-cyclonedds/cyclonedds/pulls/863,
74,closed,2021-06-28 12:24:28,1349.0,2021-06-28 12:46:57,1,862,Backport fix for missing braces in mcpp,https://api.github.com/repos/eclipse-cyclonedds/cyclonedds/pulls/862,
75,closed,2021-06-28 09:55:25,,,1,861,Fix warn '[-Wmisleading-indentation]' in if statement,https://api.github.com/repos/eclipse-cyclonedds/cyclonedds/pulls/861,
76,closed,2021-06-28 09:54:57,,,1,860,Fix warn '[-Wmisleading-indentation]' in if statement,https://api.github.com/repos/eclipse-cyclonedds/cyclonedds/pulls/860,
77,closed,2021-06-28 06:58:40,2972.0,2021-06-28 07:48:12,1,859,Remove dead code from mcpp (CID 329677),https://api.github.com/repos/eclipse-cyclonedds/cyclonedds/pulls/859,
78,closed,2021-06-28 06:58:25,2977.0,2021-06-28 07:48:02,1,858,List include files in CMakeLists.txt,https://api.github.com/repos/eclipse-cyclonedds/cyclonedds/pulls/858,
79,closed,2021-06-25 13:33:36,4303.0,2021-06-25 14:45:19,2,857,Simple renames,https://api.github.com/repos/eclipse-cyclonedds/cyclonedds/pulls/857,
80,closed,2021-06-25 11:13:32,2111.0,2021-06-25 11:48:43,1,856,Removed global shared memory mutex,https://api.github.com/repos/eclipse-cyclonedds/cyclonedds/pulls/856,
81,closed,2021-06-25 07:23:50,367985.0,2021-06-29 13:36:55,2,855,Use constants for security property names,https://api.github.com/repos/eclipse-cyclonedds/cyclonedds/pulls/855,
82,closed,2021-06-24 14:35:42,73326.0,2021-06-25 10:57:48,1,854,Fix include of symlinked files,https://api.github.com/repos/eclipse-cyclonedds/cyclonedds/pulls/854,
83,closed,2021-06-24 12:24:27,2281.0,2021-06-24 13:02:28,25,853,CRL support,https://api.github.com/repos/eclipse-cyclonedds/cyclonedds/pulls/853,
84,closed,2021-06-23 17:33:13,50381.0,2021-06-24 07:32:54,4,852,Fixes for the remaining Coverity issues,https://api.github.com/repos/eclipse-cyclonedds/cyclonedds/pulls/852,
85,closed,2021-06-23 07:48:38,30233.0,2021-06-23 16:12:31,1,850,Update Cyclone DDS quality declaration,https://api.github.com/repos/eclipse-cyclonedds/cyclonedds/pulls/850,
86,closed,2021-06-22 16:11:38,68847.0,2021-06-23 11:19:05,2,849,Fix FreeRTOS+LwIP builds + one more coverity fix,https://api.github.com/repos/eclipse-cyclonedds/cyclonedds/pulls/849,
87,closed,2021-06-22 13:43:29,1643.0,2021-06-22 14:10:52,8,848,Fixes for some of the Coverity issues in the IDL compiler,https://api.github.com/repos/eclipse-cyclonedds/cyclonedds/pulls/848,
88,open,2021-06-22 10:58:02,,,1,847,Added QNX OS support,https://api.github.com/repos/eclipse-cyclonedds/cyclonedds/pulls/847,
89,closed,2021-06-22 08:00:20,2958.0,2021-06-22 08:49:38,3,846,Coverity fixes to Cyclone core,https://api.github.com/repos/eclipse-cyclonedds/cyclonedds/pulls/846,
90,closed,2021-06-22 07:53:02,,,1,845,Fix the behavior of preprocessor with include directory search list,https://api.github.com/repos/eclipse-cyclonedds/cyclonedds/pulls/845,
91,closed,2021-06-18 15:46:13,6285484.0,2021-08-30 09:44:17,7,842,Add support for building with mingw-w64,https://api.github.com/repos/eclipse-cyclonedds/cyclonedds/pulls/842,
92,closed,2021-06-17 08:17:26,1854.0,2021-06-17 08:48:20,1,840,Fix mistyped ddsrt_mtime_t.,https://api.github.com/repos/eclipse-cyclonedds/cyclonedds/pulls/840,
93,closed,2021-06-16 18:29:02,50476.0,2021-06-17 08:30:18,1,839,Do not publish documentation on pull requests,https://api.github.com/repos/eclipse-cyclonedds/cyclonedds/pulls/839,
94,closed,2021-06-16 14:16:08,7356.0,2021-06-16 16:18:44,2,838,Fix dds_find_topic_scoped handling of topics in different participants,https://api.github.com/repos/eclipse-cyclonedds/cyclonedds/pulls/838,
95,closed,2021-06-15 09:59:06,83901.0,2021-06-16 09:17:27,6,836,Fixes for errors and warnings on FreeRTOS,https://api.github.com/repos/eclipse-cyclonedds/cyclonedds/pulls/836,
96,closed,2021-06-14 14:39:38,238855.0,2021-06-17 09:00:33,7,835,Use original filename if include is located in additional include directory,https://api.github.com/repos/eclipse-cyclonedds/cyclonedds/pulls/835,
97,closed,2021-06-10 15:55:55,1199110.0,2021-06-24 13:01:05,25,834,Implement Certificate Revocation Lists in security authentication,https://api.github.com/repos/eclipse-cyclonedds/cyclonedds/pulls/834,
98,closed,2021-06-10 10:33:13,95265.0,2021-06-11 13:00:58,5,833,Fixes for issues introduced by merging the iceoryx branch,https://api.github.com/repos/eclipse-cyclonedds/cyclonedds/pulls/833,
99,closed,2021-06-07 14:04:35,71345.0,2021-06-08 09:53:40,2,828,Fix C.UTF-8 warnings generated by idlc,https://api.github.com/repos/eclipse-cyclonedds/cyclonedds/pulls/828,
100,closed,2021-06-07 09:14:41,84234.0,2021-06-08 08:38:35,1,826,Switch Coverity Scan build to Clang,https://api.github.com/repos/eclipse-cyclonedds/cyclonedds/pulls/826,
101,closed,2021-06-03 17:53:50,63642.0,2021-06-04 11:34:32,2,825,Fix submission to Coverity Scan,https://api.github.com/repos/eclipse-cyclonedds/cyclonedds/pulls/825,
102,closed,2021-06-03 13:52:14,1134.0,2021-06-03 14:11:08,1,824,"Really fix submission to Coverity Scan, hopefully",https://api.github.com/repos/eclipse-cyclonedds/cyclonedds/pulls/824,
103,closed,2021-06-03 13:11:41,877.0,2021-06-03 13:26:18,1,823,Fix submission to Coverity Scan,https://api.github.com/repos/eclipse-cyclonedds/cyclonedds/pulls/823,
104,closed,2021-06-02 12:51:55,,,1,820,libidl version number independent of project,https://api.github.com/repos/eclipse-cyclonedds/cyclonedds/pulls/820,
105,closed,2021-06-01 11:36:47,259192.0,2021-06-04 11:36:39,1,818,"Allow base types, enums and strings as key",https://api.github.com/repos/eclipse-cyclonedds/cyclonedds/pulls/818,
106,closed,2021-05-31 16:09:59,1281191.0,2021-06-15 12:03:10,1,816,Add pipeline for publishing documentation,https://api.github.com/repos/eclipse-cyclonedds/cyclonedds/pulls/816,
107,closed,2021-05-26 14:47:04,1013.0,2021-05-26 15:03:57,1,814,Typo fix,https://api.github.com/repos/eclipse-cyclonedds/cyclonedds/pulls/814,
108,closed,2021-05-25 19:16:47,,,1,812,typo fix,https://api.github.com/repos/eclipse-cyclonedds/cyclonedds/pulls/812,
109,open,2021-05-25 12:53:29,,,4,810,Bitmask support in idl compiler front-end,https://api.github.com/repos/eclipse-cyclonedds/cyclonedds/pulls/810,
110,closed,2021-05-25 12:33:38,156127.0,2021-05-27 07:55:45,1,809,Dereference as void* to avoid crash with -O2,https://api.github.com/repos/eclipse-cyclonedds/cyclonedds/pulls/809,
111,closed,2021-05-19 15:57:39,750617.0,2021-05-28 08:27:56,5,806,Improve handling of external vs internal addresses,https://api.github.com/repos/eclipse-cyclonedds/cyclonedds/pulls/806,
112,closed,2021-05-18 15:31:12,1815869.0,2021-06-08 15:55:41,144,805,Merge Iceoryx integration into master,https://api.github.com/repos/eclipse-cyclonedds/cyclonedds/pulls/805,
113,closed,2021-05-17 14:57:19,2512.0,2021-05-17 15:39:11,3,803,Fix broken assert in network partition config,https://api.github.com/repos/eclipse-cyclonedds/cyclonedds/pulls/803,
114,closed,2021-05-17 09:58:28,182341.0,2021-05-19 12:37:29,5,802,Automated documentation generation in CI,https://api.github.com/repos/eclipse-cyclonedds/cyclonedds/pulls/802,
115,closed,2021-05-12 14:30:37,429911.0,2021-05-17 13:55:48,1,797,Fixes for idl parser related to enums,https://api.github.com/repos/eclipse-cyclonedds/cyclonedds/pulls/797,
116,closed,2021-05-11 13:07:58,6102.0,2021-05-11 14:49:40,15,796,Merge master into iceoryx branch,https://api.github.com/repos/eclipse-cyclonedds/cyclonedds/pulls/796,
117,closed,2021-05-07 18:24:13,219820.0,2021-05-10 07:27:53,2,792,Update allocator API for special case of heap allocation,https://api.github.com/repos/eclipse-cyclonedds/cyclonedds/pulls/792,
118,closed,2021-05-07 16:46:14,240619.0,2021-05-10 11:36:33,3,791,Support stdin as input for compiler + some fixes,https://api.github.com/repos/eclipse-cyclonedds/cyclonedds/pulls/791,
119,closed,2021-05-07 02:08:15,19968.0,2021-05-07 07:41:03,1,789,Use PROJECT_SOURCE_DIR instead of CMAKE_SOURCE_DIR.,https://api.github.com/repos/eclipse-cyclonedds/cyclonedds/pulls/789,
120,closed,2021-05-06 13:46:29,11509919.0,2021-09-16 18:58:28,16,788,Avoid serialization in write for volatile writers,https://api.github.com/repos/eclipse-cyclonedds/cyclonedds/pulls/788,
121,closed,2021-05-06 09:36:56,,,1,787,Allow Iceoryx use for best-effort readers,https://api.github.com/repos/eclipse-cyclonedds/cyclonedds/pulls/787,
122,closed,2021-05-06 09:36:40,,,1,786,ddsi_ipaddr_is_nearby_address: ignore non-IP ones,https://api.github.com/repos/eclipse-cyclonedds/cyclonedds/pulls/786,
123,closed,2021-05-04 14:57:28,8057.0,2021-05-04 17:11:45,1,784,Register number of unused labels in union,https://api.github.com/repos/eclipse-cyclonedds/cyclonedds/pulls/784,
124,closed,2021-04-30 12:15:46,1459.0,2021-04-30 12:40:05,1,782,Fix IDL_PRINTA redirect for Visual Studio,https://api.github.com/repos/eclipse-cyclonedds/cyclonedds/pulls/782,
125,closed,2021-04-29 10:29:05,,,6,781,"Suppress heartbeat/ack/historical data if Iceoryx, add test for CI",https://api.github.com/repos/eclipse-cyclonedds/cyclonedds/pulls/781,
126,closed,2021-04-29 09:26:52,14773.0,2021-04-29 13:33:05,2,780,Update README.md,https://api.github.com/repos/eclipse-cyclonedds/cyclonedds/pulls/780,
127,closed,2021-04-29 07:15:31,21891.0,2021-04-29 13:20:22,1,779,Add missing build_depend on JDK for IDLC in package.xml,https://api.github.com/repos/eclipse-cyclonedds/cyclonedds/pulls/779,
128,closed,2021-04-28 14:51:46,684354.0,2021-05-06 12:57:40,2,778,Improved shared memory documentation,https://api.github.com/repos/eclipse-cyclonedds/cyclonedds/pulls/778,
129,closed,2021-04-28 13:42:21,519401.0,2021-05-04 13:59:02,1,777,Delete ddsls,https://api.github.com/repos/eclipse-cyclonedds/cyclonedds/pulls/777,
130,closed,2021-04-26 11:54:41,188468.0,2021-04-28 16:15:49,1,776,Add package target to create installers for different platforms,https://api.github.com/repos/eclipse-cyclonedds/cyclonedds/pulls/776,
131,closed,2021-04-26 08:11:04,184755.0,2021-04-28 11:30:19,3,775,Some fixes IDL compiler for parsing annotations,https://api.github.com/repos/eclipse-cyclonedds/cyclonedds/pulls/775,
132,closed,2021-04-26 07:04:57,24768.0,2021-04-26 13:57:45,2,774,Numeric locator kinds,https://api.github.com/repos/eclipse-cyclonedds/cyclonedds/pulls/774,
133,closed,2021-04-25 20:36:01,,,2,773,Add API to initialise data allocator to allocate on heap,https://api.github.com/repos/eclipse-cyclonedds/cyclonedds/pulls/773,
134,closed,2021-04-22 18:03:51,147.0,2021-04-22 18:06:18,2,772,Revert data allocator api change,https://api.github.com/repos/eclipse-cyclonedds/cyclonedds/pulls/772,
135,closed,2021-04-22 17:57:56,511866.0,2021-04-28 16:09:02,2,771,Add idl_is_keyless for C++ generator,https://api.github.com/repos/eclipse-cyclonedds/cyclonedds/pulls/771,
136,closed,2021-04-21 22:44:02,35040.0,2021-04-22 08:28:02,2,768,Update data allocator API to also support allocation on the heap,https://api.github.com/repos/eclipse-cyclonedds/cyclonedds/pulls/768,
137,closed,2021-04-21 11:25:52,75634.0,2021-04-22 08:26:26,35,767,Various fixes + merge master,https://api.github.com/repos/eclipse-cyclonedds/cyclonedds/pulls/767,
138,closed,2021-04-16 14:34:55,,,1,765,Getting bison to be optional.,https://api.github.com/repos/eclipse-cyclonedds/cyclonedds/pulls/765,
139,closed,2021-04-16 14:34:25,1043185.0,2021-04-28 16:20:50,1,764,Install the pdb files for msvc,https://api.github.com/repos/eclipse-cyclonedds/cyclonedds/pulls/764,
140,closed,2021-04-16 11:58:33,341191.0,2021-04-20 10:45:04,2,763,Fix defects reported by Coverity Scan,https://api.github.com/repos/eclipse-cyclonedds/cyclonedds/pulls/763,
141,closed,2021-04-15 18:58:26,,,1,762,edit to reflect the progress from original PoC,https://api.github.com/repos/eclipse-cyclonedds/cyclonedds/pulls/762,
